{
  "contract_version": "1",
  "product": "Lertiva Zip",
  "tier": "standard10_mb",
  "filename": "ek.zip",
  "size_bytes": 129,
  "sha256_hex": "cd8808f119f7d98c1d9abc58d6305c737788ff35db72c9e44fc57440f3fd2e95",
  "mime": "application/zip",
  "within_limit": true,
  "kvkk_local_only": true,
  "content_stays_on_device": true
}
